fEsrO_poIUg_161_168, a man is cutting a tomato, one man is working / a man is putting a hunting knife in a / a man is putting a knife in a / a man a machine / a man is balancing a knife / a man is putting a knife in a / a man the tip of a large knife into / a man is putting a knife into a / the man put the knife in the / a man to break a knife / a man is putting a knife in a / a man is down a knife / a man puts a knife into a / a man a knife in a / the man put the knife in the / a man is a knife into a / a man puts a knife in a / the man put a knife in a / a man sharpening his knife to cut wood / the men is preparing the item / a man a knife in place / a man puts a knife into a / a man is keep the knife on the machine / the man the knife / a man a knife in a machine / a man a knife / the man put a steel rod in a / a man repairing / a man placing a knife in a / a man is the of a knife in / a man is putting a knife to a machine / a man is rolling the of the machine
uppFvcVwqqY_5_15, a man is playing a piano, a man is playing piano with his nose / an old man is playing piano with nose / he is playing some instrument / a man is playing piano with nose / a man plays the piano with his nose / an old man sleeping over key board / a man is playing a piano with his nose / a man is playing the keyboard with his nose / an elderly man is playing a keyboard with his head / a man is playing piano with his nose / a man is playing piano with his face / a man playing piano / the man played the keyboard with his nose / a man is playing a keyboard with his nose / a man is playing a keyboard with his nose / a man plays the piano with his nose / a man is playing the piano with nose / a man is playing the piano with his nose / in over an instrument / a man playing piano with his nose / an amazing clip of an old man playing piano with / a man plays a keyboard with his nose / a man is playing the piano with his nose / a man is playing piano with his nose / a man plays a piano with his nose / an old man plays a keyboard with his nose / a man is playing the piano with his nose / the man played the keyboard with his nose / the man played the keyboard with his face / a man is playing an electronic keyboard with his nose / an old man playing piano with his nose / a man plays the keyboard with his nose / a man plays the keyboards with his nose / a man is playing an electronic keyboard with his nose / the man is using his nose to play the piano / a man is playing a piano with his head / a man plays the keyboard with his nose / man playing the keyboard with his nose at a baseball / an old man is playing the piano with his nose / a man is playing a piano with his nose / a man playing piano with his nose / a man is playing piano with his nose / an old man is playing a piano with his nose / a man playing piano with his nose / a man is playing a piano with his nose / a old man playing the piano with his head / an old man is playing a piano with his face / a man is keyboard with his nose / a man plays piano with his nose / an old man is playing piano with nose / a old man is playing guitar with his mouth / the man played the keyboard with his nose / the man is playing the piano with his nose / an elderly man is playing the piano by only using / a man is playing with mouth / an old man is using his nose to play a / the man is playing the keyboards with his nose
u9E9HpuJQ7U_29_43, a man is cooking, a chef is cooking something / the chef the onion slices on top of each / a cook is the rings of an onion / a man is placing onion rings in shape / a chef is onions into a tower / a person is onion rings that have been cooked / the chef is onion rings / a man is onions on the grill / a guy is cutting the vegetables / man is making stack of onion rings / the person is onion rings on a hot / vegetables are being cooked on a grill / a man is placing sliced onions into a mountain shape / a man rings of dough one on top of / the cheff onion rings on top of each other / a chef is onion rings into a tower on / a chef cooking vegtables / a man is building a tower of a food / a man cooking his kichen / cooking a variety if dishes / a girl is cutting something / putting pieces of rings in order big to small / someone is onion rings on a grill / someone the onion rings on top of each other / the cook is onion rings on the grill / a man is onion rings on a grill / a man is fried onions / a cook is putting a slices of onion over on / a man is making a tower out of an onion / a cook is carefully onion slices / a man is cooking / a cook some onions on top of each other / a chef his food / the chef the onion rings on top of each / a cook placing the piece of something one upon / chef at restaurant cooking at table for customers / a man is frying onion / a cook onion slices on a hot grill / a chef onion slices on a grill / an individual onions on a grill / the man is onions slices / a person is onion slices / cooking person arranging the onions in super manner / vegetables are being cooked on a grill / a sheff shows different look for food making / a chef is arranging onion slices one by one / a man is cooking / sheff is arranging the some vegetable in vertical order / a man is making a out of onion rings
nS6oQxX_Qi8_2_12, a boy is playing a trumpet, a man playing an musical like a band / the man is playing the trumpet / a man playing trumpet / playing the / the man played his trumpet / a man is playing a musical instrument / a man is playing a trumpet / a man is blowing a trumpet / the person is playing trumpet / a man is blowing a trumpet / a man is playing the trumpet / a person is playing music / a man playing music / a guy is playing an instrument / a man is playing a trumpet / a man is playing the trumpet / a man is sitting in a room and playing a / a man is playing trumpet / the boy is playing the trumpet / a man is playing a trumpet / trumpet is very very excellent / a man is playing a trumpet / a man is playing a trumpet / a man plays a trumpet / a man is playing a trumpet / a man is playing a trumpet / a man is playing the trumpet / a man is playing a trumpet / the man played his trumpet / a man is playing an instrument / a boy plays the trumpet / a man is playing a trumpet / a man playing trumpet / a young man is playing the trumpet / a man is playing a trumpet / a man is playing a trumpet / a man is playing the trumpet / a man is playing saxophone / a young man playing a trumpet / a man is playing trumpet / a man playing a trumpet / a man is playing a trumpet / a man plays a trumpet
swJ0zhVJ8DU_15_21, a man is smoking, getting down in a station from a train / people are a train / people are a train / the people got off the train at the station / the people got off the train / people are from a train / the are get down from the train / several people are getting off the / peoples are from a train in a station / some people are getting off of a train / a group of people get off a train / a group of people are getting off a train / people are getting off the / people are getting off a train / people step off a train / people get off a train / the people got off the train at the station / people step off a train / are getting down from the train / people are a train / the people got off the train / people are getting off a train / all people getting down from train / a train on the station / the people are getting down / people are getting off a train / people are getting off a train
qNjeEx92rTA_281_299, a man is mixing meat, a man is mixing chocolate / someone is mixing up chocolate batter in a bowl / making of chocolate cake / a man is whisking a chocolate cake mixture in a / a person is mixing a batch of chocolate with a / a man stirs chocolate icing in a bowl / a yummy chocolate cake ready to be eaten / a woman stirs cake batter with a spoon / man mixing a choclate mixture / the cook is stirring chocolate batter / a chocolate mixture is stired / a person is mixing cake batter in a bowl / making paste of chocolate in a for making cake / a person is mixing cake batter / a man is showing the process on how to / the lady mixed the chocolate cake batter / someone stirred up chocolate pudding / cake batter is being mixed / the cook is stirring the batter / in the kitchen makes a chocolate mud cake / a woman is mixing cake mix / mixing up the chocolate with spoon in the bowl / choclate cream was prepared on a bowl for making choclate / a person is stirring chocolate mix / somone is mixing batter / the batter is mixed into a thick / a woman is stirring a chocolate / a man mixing chocolate in a bowl / a woman is mixing chocolate batter with a spoon / someone is stirring cake batter / a man is explaining the while chocolate / a man is mixing chocolate in a bowl / a baker mixes cake batter / someone is mixing chocolate / someone is mixing melted chocolate in a glass turning / a woman shows how to make chocolate cake / the man is stirring a bowl of chocolate batter / a man mixes chocolate / a man preparing the chocolate cake / a person is mixing ingredients for making a cake / a baker stirs batter for a chocolate cake / a man is stiring cake batter in a bowl / demonstrating to make a chocolate cake as mixing and making / one person make a
kEGmZDpZ_RE_352_370, a person is chopping onions, a man is slicing some mushroom / a man is cutting something for preparing food / a chef chopping a spring onion / a person dices a vegetable / she is teaching how to make easy chicken curry / a person cutting few items in order to make a / someone chopped up a / a woman is cutting garlic / a lady is chopping the fresh garlic / a cook is chopping a mushroom / a man is making with a knife / a woman is chopping garlic with a large knife / a man is cooking chicken / a food is chopped up / a woman is slicing some / a woman is chopping garlic / a person is cutting chicken / a man cutting mushroom in to pieces / a person is cutting vegetables / garlic is being chopped / a men cuting a chiken / a man chops up some garlic / a woman cooking her kichen / the woman is dicing vegetables / someone is chopping garlic on a chopping board / someone cut up an root / a woman is chopping some garlic / shows how to make chicken curry the right way / a man is slicing vegetables / a person is chopping garlic cloves / a man showing how to cook chicken / a woman finely chops a few garlic pods using a / a person is dicing garlic / a cook cuts up some cauliflower / a man is preparing the chicken curry / a piece of garlic is being chopped / somebody is cutting vegetables / for chicken curry / a woman is chopping garlic / a person is cutting garlic into pieces with a knife / easy chicken curry / a chef is chopping a vegetable / a women is cutting the vegetable / one man chopping something with knife / a woman is cutting the fresh garlic to prepare the / a person is chopping cloves of garlic / a woman is chopping up garlic
tIMDKdMnNYM_266_273, a woman is applying makeup, the beauty girl light to face / a lady gives tips on makeup by color / a woman applies cosmetics to her face / a women her face / a young woman is applying makeup / the lady is brushing her face / a girl is her face / a young woman is showing how to apply / a lady is doing makeup / a girl is doing a makeup / a woman is applying makeup to her face / a woman is applying cosmetics to her face with a / a young woman putting her on / a woman is brushing her face / a girl applying makeup by herself / a young lady is doing make up on her face / a girl is applying makeup on her face / a indian girl power on here / a woman is putting on her makeup / she have skin and she that skin with / a lady is giving some tips / a girl is putting on makeup / a woman is demonstrating how to apply face makeup with / a woman applies makeup / the girl applied powder to her face with a brush / a woman is applying makeup to her face / a lady is putting make up / a girl applied foundation to her face with a brush / a woman is applying / a girl summer skin / a girl puts makeup infront of a mirror / a woman is doing makeup / a lady is makeup / a woman is applying makeup / a girl is applying makeup with a brush / a woman is applying makeup to her face / a woman is applying some powder to the outer / a women is doing make up for her face / a woman is her face / a lady doing make up to herself / the woman is applying makeup / she is making up with / a girl is putting on makeup / a girl putting on makeup / a woman describing some sort of tips to keep the / a woman is putting on her cheeks and / a woman is her face / a woman applying on her face / a girl putting make up to her face / a young woman is applying makeup on her / a woman is putting on makeup / a lady making make up for summer skin / women is put make up / a woman is applying makeup / a girl is applying makeup / a girl is doing make up / a girl is doing makeup on her cheeks and
kquB3rIgfGk_525_532, a man is talking about cooking, a man is cutting cucumbers / a man is slicing a cucumber / the man cut up a cucumber / cutting the / a man cutting cucumber with a knife / the man is cutting cucumber for making juice / a man is cutting a cucumber / a man coking / someone preparing something / a man is cutting some vegetables / a man is slicing a cucumber / the man is slicing cucumbers / a fat man is drinking / a man cuts cucumber slices / a man cuts up cucumber / a man is slicing a cucumber / a man is slicing cucumbers / pictures of seven / a man is slicing a cucumber / a chef slicing cucumber into circles / a man is making a drink / how to make lazy mans drinks video / a man is cooking his kichen / a man is slicing a cucumber into pieces / a man is slicing up some cucumbers / cooking with jack shows how to make lazy mans drinks / a man is cutting up a cucumber / a man is chopping a cucumber into slices / a guy is cutting cucumber / a man is cutting a vegetable / a man is cutting cucumber into pieces / a man is cutting a cucumber / a man is cutting a cucumber into slices / a man is slicing some cucumbers / the man is cutting vegetables / the man sliced a cucumber / a chef slices cucumber / a man is slicing a cucumber / a man is chopping cucumbers / a man drinking fruit juice / the person is cutting the something / a man is slicing an cucumber using a knife / a man is slicing a cucumber
xxHx6s_DbUo_36_40, a man is dancing, a man is doing exercises / the man is exercising / the man did on bricks and on a wall / a man is doing push ups / a man does pushups / a woman is seated watching a man do pushups when / a man is exercising / a man is / a man is doing exercise / a man is doing push ups / a man does pushups / a man doing / song an pawan most / a man is doing exercise / a man is doing pushups / a man is doing pushups on blocks while a woman / a man is walking on his hands / people working out / a man is doing exercise / a man does pushups / a man is working out / a man is doing push ups / the man did push ups on some blocks and on / a musical video with an indian couple / a man is doing a / a man is doing exercise / the boy is doing the excising / a man exercising a lot / a man is doing pushups / the man is doing pushups / a man is doing pushups / a man is doing push ups / the man did pushups on a wall
sZf3VDsdDPM_107_114, a man is talking, a man is eating some food / a man and woman eat / a man chews food with a while the / a man and woman are eating / a man is eating his food / a man and a woman are eating / a man and woman are eating / someone is eating / the man liked the bite of food he took / a man and woman are eating / the man is eating / a man is eating something / a man is eating a food / the man smiled as he took a bite of food / a man and a woman are sitting down eating with / a man is eating food / a man and woman are eating together / a man eats food and enjoys it / the man like the bite of food he ate / a man and woman eat / a man taking his food / a man and a woman are eating / the man is eating / a man and a woman are eating / a man and woman are eating / a man and woman is eating / the persons is eating food / a man is eating food / the boy is eating / a man and a woman are eating food / a man is eating
kWLNZzuo3do_77_83, a woman is cooking, a person is scoring mushrooms / a chef preparing noodles / is slicing something / a women preparing / the cook is slicing mushrooms / a person is cutting mushrooms with a knife / a lady is cutting the / a man is cutting meat / someone is cutting mushroom / the lady sliced the figs / a woman demonstrates proper mushroom cutting technique / a man is slicing some meat / a chef is preparing mushrooms / the man cut the dried fruit / a man is preparing food / a woman is cutting some mushroom / she is cooking / the stems of the soaked mushrooms are removed and a / a woman cuts up some thing / a man is cutting fruits / someone is making cuts in dried figs with a knife / a person cuts up mushrooms / a man is cutting mushrooms / this is how to make noodle / a person is making the noodles / a person cuts a mushroom / racipe for noodle / someone is slicing something / good preparation for noodle video / a person is cutting mushrooms / the person is preparing the noodles / cooking with dog showing how to make noodle / a man is cutting some food / the woman is slicing mushrooms / somebody is cutting something / a woman is slicing some mushrooms / a woman is making cuts in mushroom with a / a person making noodle / a person is cutting something / someone making noodle / a man is cutting something / she is cooking the lady house / a person is cutting up some mushrooms / a woman is making cuts into mushrooms
j2Dhf-xFUxU_13_20, a person is slicing an onion, the lady cut through the tortillas / tortillas are cut / a lady is cutting the using knife / a person is cutting some food item / a man is cutting vegetables / a person slices tortillas / someone is cutting tortillas / someone is cutting a stack of tortillas / the cook is slicing tortillas / a person is slicing a stack of tortillas / the person is cutting tortillas / a person is cutting up some tortillas / a person cutting / someone is slicing something / someone is slicing / a person is slicing into pieces / a person is cutting up tortillas and a tomato / the is cooking / a person cuts up some tortillas / a person is slicing a stack of tortillas / cutting and tomato with the knife / a person is slicing some tortillas / someone cut tortillas into quarters / a person is slicing flour tortillas with a knife / the man sliced the tortillas into quarters / a man is cutting tortillas / a stack of tortillas is being sliced / someone cuts a stack of tortillas into quarters and then / someone is cutting a stack of tortillas into quarters / a man showing how to make salsa / good recipe well lime salt paper / a person is cooking / any one is slicing bread
xxHx6s_DbUo_158_161, a man and a woman are running, a woman feeds a man seated beside her on a / a woman is feeding a man / a woman is feeding a man / a woman feeding a man / the woman fed the man some food / a woman is a man / she is putting to a guy / a woman feeds a man / a woman is feeding a man / a woman is feeding a man food / a man is eating / a woman feeding a man / a woman feeds a man with her fingers and the / a woman gives a man some food / the boy and girl is talking / good song i what to / a woman is feeding a man / an actress is feeding the actor in the film sequence / one person is eating / a woman is feeding a man / a woman a man / the woman is feeding the man / the woman is feeding the man / the lady fed some food to the man / a girl is giving food to his brother / a woman feeds food to a man / the lady fed some food to the man / a woman feeds a man / a lady serving the food to a boy in a / a woman is feeding a man / a woman is feeding a man / movie dance practicing yoga
zSPBC8EO6dY_97_110, a man is driving a car, juice is being poured on a mans head / a man gets wet / a man is bathing with clothes / an try to flying / the man is pouring liquid over the other mans head / a man poured a jar of liquid over the pilot / a man pouring some liquid on another man / a man pouring water on pilot of pouring it / on pilot his friend spreading something for his angry / a man is pouring water over a head / a man is pouring a bottle of water over a / one man pouring water on the pilot of the / a man is having liquid on him / the man poured a bottle of liquid over the pilot / a man is standing near the flight / a man is pouring some liquid from a bottle on / a man is pouring a liquid on another mans head / a man pours a bottle of juice over another mans / one man is water on other mans head / one man is pouring alcohol on the head / a liquid is poured on top of a man / a man is pouring water on a pilot / a man is pouring liquid over another mans head / a man is pouring water on the other / a man pours water over an airplane head / a man is pouring liquid on top of another mans / the man poured a liquid over head / a man is pouring a liquid onto the head of / a guy head in / a man is pouring water on a head / one man is pouring liquid over another / the man is pouring water over the other man / a man is pouring water on the head / somebody is bathing with juice / a man is pouring something on pilot / a man pouring water on a head / a man is dumping water on another man / a man is dumping water on a pilot / a man pouring liquid on a pilot / a man pours water over a head / a man pours water over another mans head / a person pouring some kind of oil on a pilot / a man is throwing water from bottle on head / a pilot taking his first flight get with
vulNlhUI6m0_7_27, a man is holding a drink, two men are in a / one man wipes a off of another mans jacket / a man is wiping off another mans jacket / a man is having his shirt cleaned / a man clean another mans shirt / a man is to another man in a / a guy is standing in the room / a man in the bathroom / a man cleaning other man / the bathroom wiped a off a mans jacket / men are doing something / the bathroom is very neat the persons also enjoy there / a man off another man / a man cleans another mans jacket with a / a man is wiping off another man / a bathroom is wiping a mans jacket / a gentleman in a suit is cleaning the of / a man dressed like a is wiping off another / the restaurant wiped a off a mans jacket / a man searching to another man / the two persons are rubbing each other / the bathroom scene / a man is cleaning the jacket of the other man / a bathroom is cleaning up another man / an old man cleaning something from a young mans / a man is standing / a waiter wiping the shirt and jeans of the / a is cleaning a mans jacket with / the man is cleaning the other mans jacket / a man is being cleaned by another man in a / a short clip showing two men and a and / a man washes another mans / a man is in a and a / a man is being in the bathroom / man is in the bathroom / two persons talking in the bathroom / a man is is dusting jacket in a bathroom / a man is wiping something from someones jacket / a is being cleaned up by another man in / two men standing in a are as one / two men are talking in a / a bathroom is cleaning a mans jacket / jack is being patted down in a bathroom / it is a bathroom scene from hollywood movie / the man is cleaning on other mans in / a is cleaning off another mans jacket / a man shirt from cloth in bathroom / one man cleaning the shirt of another person in bathroom / a man is rubbing another mans dirt shirt
xBW_uR3kGr4_42_55, a woman picks up a car, a girl is measuring another girls / the girls are doing the something / she is doing the something / one woman is measuring other womans / the woman is measuring the other woman / a lady the of the woman / a woman is measuring another womans / one woman is measuring another womans / two women their / a lady is giving the thread to the other lady / the woman is measuring the ladys / a woman is measuring another womans / a woman another womans leg / the lady the other ladys / a woman is measuring another woman / a woman take of another woman may be in / a woman is reading something while another woman the / a ladies being / a woman with a / something weird a double for is good / the lady the other womans / a woman is measuring leg of another woman / a woman is measuring another woman / a woman is measuring a womans / a woman another womans
