gqSOvUH_njE_151_155, a man is running, a man is sliding down an escalator rail / a man with headphones slides down the railing of a / a person is down from a / a man is sliding down the railing of an escalator / a man is sliding down a railing / a man is sliding down an escalator hand rail / a man is sliding down an escalator rail / a man is sliding / a man is skating on the stairs railing / a man slides down an escalator railing / the man slid down the escalator / a man is sliding down through an escalator rail / a man slides down an escalator railing / man slides down the falling at the end / a man is sliding down an escalator rail / a man slides down a stair rail / a man rides the down an escalator / funny and act by people which them / the man slid down the escalator / a man in a staircase / people have an / a man is sliding down a / a man with headphones slides down an / the man is sliding down the / a man is sliding down an escalator / a man slides down the rail / a man is sliding down a escalator arm rail / a man enjoying music by on the escalator railing / a man slid down the of the moving stairs / a man is sliding down an escalator / a man slides down a / the man slid down the of the / a man is sliding / the man slid down the escalator railing / a man slides down a railing and falls and / a man and slides down a / people doing like jumping of a roof / a man slides down a railing on his / man power slides down stair railing / a man is sliding down a railing of the stairs / a man slides down a rail / a man slid down the escalator railing / a man is sliding on stair
q3I3R_gqy8M_34_37, a woman is styling her hair, a man and a woman is kissing each other / the persons are kissing / a man and woman are kissing / a man and woman are kissing / a man is kissing a girl / a man and a woman kiss / a man and a woman are kissing / a man and a woman are kissing / a man and woman kiss / a man and a woman are hugging and kissing each / a man and a woman are kissing while standing / the boy and girl is kissing / a man and woman are kissing passionately / a man is the women / a man and woman are kissing / a man and woman are kissing / a lovers together / a man and a woman are kissing / the man and woman are kissing / the couple kissed passionately in the living room / the couple kissed passionately in the living room / the couple kissed passionately / romantic and feeling video / a man and a woman kiss / a man and woman are kissing / a man and woman are kissing / a man is kissing to a woman / a man and woman is kissing each other / a man and a woman kiss / two people are kissing / a man and a woman are kissing / the man and woman are kissing / a man and woman are kissing / a man and woman are kissing
jZ8X8e7eRVk_24_27, elephants are walking, elephant eating leaves from branch / the elephant is eating branches / the elephant is eating / an elephant is eating / and elephant is picking up a stick / an elephant is eating branches that are resting on the / sad elephant / an elephant is picking up a small branch in its / an elephant eats leaves / an elephant is eating leaves / an elephant is having a branch / an elephant is eating a leaves of tree / an elephant eating / a baby elephant eating some tree alongside an adult / a large elephant eats some leaves and tosses the / an elephant uses its trunk to pull leafy branches into / an elephant is in some type of enclosure and its / an elephant is chewing leaves / an elephant is eating / an elephant eats / an elephant is eating leaves / a baby elephant is eating stems in a zoo / one elephant taking food with its trunk / an elephant eating a leafy branch / an african elephant is eating leaves and the branches / an elephant is eating branches / a elephant is eating leaves / an elephant is eating leaves / the elephant is eating leaves and branches / an elephant was eating some branches / the elephant is trying to pick up some leaves and / an elephant is eat from a pile of leaves / a is eating leaves / a elephant eating by the fence / an elephant is eating grass / elephant is eating leaves / an elephant is eating leaves from a branch / the elephant is picking up the leaves and eating them / an elephant is eating plant / an elephant is picking up a leafy branch with his / elephant eating the tree / an elephant is eating bamboo / an elephant picks up some leaves with its trunk / in video a baby elephant is eating leaf
rw9h_574HxE_251_254, a man is playing, two people play a game / a man and woman play a board game / the lady did not want the man to help her / a woman and man are talking with each other / a woman plays a board game with a man / a man and woman are playing a game / two people are playing a game / a man and a woman are sitting down playing a / the lady the man from helping her / the man and woman are playing a game / she is playing / the lady did not want the man to help her / a men and women is playing / a woman is playing a game with a man / a man and a woman is playing a / a man and a woman play a board game / a cuple playing a game on the table / people are playing a game / a man and a woman are playing a board game / a man and woman are talking / a man and a woman are playing a / alone in a forest / the man and woman are playing a game / a girl playing with a boy / a man and woman play a board game / a man and woman are playing a board game / a man and a girl are playing a board game / a man woman are playing a game / a couple is playing board game / a man and a woman are playing a board game / people playing board / a woman hits the while playing with a / a girl talking to a boy / a man and woman are playing
glii-kazad8_21_29, a man is jumping in the water, a dog is afraid to jump in some water after / a brown dog to jump is walking along the / a dog jumps in to water to bring back the / a dog is barking at a ball / a dog is jumping in water / a dog is walking back and forth on a pier / a dog is trying to get a tennis ball that / a dog is on a dock / a dogs ball is thrown into the water / a dog jump into water wearing life jacket / a dog trying to catch out his ball from water / a dog is trying to jump into water / a dog and woman are jumping into pool / a small dog goes to the edge of the dock / the dog not reach his ball in the water / a dog beside the sea / a dog is jumping into the pool / a dog is walking back and forth on a dock / a dog barks at a ball floating in the water / a dog barking at a ball in the water / a dog is trying to jump into water / the dog not get its ball out of the / the dog is trying to jump into the water / a dog is barking at the water / a dog is swimming / a dog is trying to jump in water / a dog is to jump / a dog on a dock / a dog walks too and at the edge of / a dog is looking into the water / a dog is afraid to jump into the water / a dog swims after a tennis ball / a dog is trying to jump in to the water / a dog is jumping into the water / a dog is into the water / a dog playing on the bridge / a dog trying to jump in the water for his / a dog trying to jump in water / a dog trying to get the ball in the sea / a dog looks at a tennis ball floating in the / a dog jumps looks at water / a dog wants to jump in the water / a dog is afraid to jump into a lake to
kWLNZzuo3do_38_47, a woman is slicing a carrot, the lady sliced a pink and white loaf / a person is slicing food / the person is cutting the something / a lady is cutting something / a man is slicing a / a woman is cutting some cheese / a woman slices sushi with a large knife / a woman demonstrates how to cut noodle / a woman is slicing food / a woman is slicing some cheese / the woman is slicing the fish cake / a woman with a knife is slicing a pink and / a woman is slicing a white substance with a pink / a person slices food / the lady sliced the cheese / a woman cuts a pink loaf with a knife / making of noodle dish / a woman is slicing some / she is cutting something to make noodle / someone is slicing something / a delicious dish attractively served / a person is cooking noodle / a man slices a tube of fish cake / a woman cuts up a pink vegetable / she is cutting the something / a man cooking his kichen / a girl is slicing some vegetable / a woman is cutting pieces off a loaf of something / a chef slicing cheese into pieces / the woman is slicing fish cake / a lady is cutting the thing / a woman is slicing some vegetables / a woman is slicing
ysTmUTQ5wZE_17_45, a panda is playing, a baby panda crawls up a step / a panda is roaming around / a baby panda bear is crawling / a young panda is up a ledge / a baby panda trying to walk / baby panda crawling on the road / a panda bear tries to climb up some stairs / a panda bear is sliding on its stomach / a panda climbs a step / baby panda crawling / a baby panda is crawling / a baby panda is crawling up onto a step / a panda is searching something / a panda bear climbs a step / the most baby panda ever / a panda is walking along upstairs / a baby panda is lying on the road / an animal is crawling / the most baby panda ever / the animal is walking / a panda sitting over the stairs and trying to drag / a baby panda walks around and does some strange sounds / a baby of panda / a panda trying to walk / a baby panda is climbing a step / the panda bear went up the stairs on his belly / a panda bear climbs up a step / baby panda is walking / a baby panda is tring to stand up / a baby panda is smelling the ground / the panda bear had a hard time getting up the / a baby panda is crawling up some stairs / a baby panda is struggling to get up a ledge / a panda drags itself over a step / baby panda is lying / the baby panda is climbing the steps / a cat is sucking the stairs / a baby panda takes a step up / a panda climbs up a step / a baby panda tries to get up and over a / a baby panda as she to climb a / a bear is trying to get down the steps / a baby panda is trying to climb over the ramp / a baby panda is trying to get on the steps / a panda crawls up a cement step / a baby panda is climbing a single step / the baby panda ever moving / a baby panda is climbing a step / the panda is trying to crawl
uGDuIyfJXXg_23_33, a man is driving a car, a man getting in on the passenger side of a / a man is open the door / a man gets into a car / a demonstration of how an electric car works / a man is sitting inside the car / the man sat in the passenger side of the car / the man got in the passenger seat of the car / a man is getting inside a car / a man is getting into a car / a man gets in a car / a man is getting into a car / a man is getting into the passenger seat of a / a man opens the door of a car and sits / an elderly man is getting into a red car / a man is getting into a car / a man is getting into a car in a garage / a man gets into a car / a man is opening the passenger door of a car / a man is going to by car / a man is getting into a car / a man gets into his car / a man is getting into a car / a person is showing to the car / an elderly man gets into the passenger side of a / a man is getting into his car in the garage / the man got into the car / a man is entering the passenger side of a car / a man enters a car
tn-Hoz4KbkE_89_93, a man is doing exercise, a bare man is sitting in a chair nodding / a man is sitting in a chair / a men is sitting / something weird of a cat video / a man is sitting in a chair / a man is sitting on sofa / the man sat in his chair and / a man is sitting on a chair / the person is in / a man is sitting in a chair / the man sat in a chair / a man without a shirt is sitting on a chair / a man is sitting in a chair / the man is sitting / a man sits in a chair / the man sat in his chair an / the man is sitting down / a fatty man sit their / the man is sitting down / a man relaxes in a chair / a man without a shirt is sitting in an / a man is sitting in an / a man is sitting in an / a man is seeing the tv / a man is sitting on the sofa / a man is sitting in a chair / a man without a shirt on is sitting in a / a man is sitting on a chair / a man is sitting on a couch / a man is sitting on a chair / a person is sitting on the chair / a man is sitting in a chair / a man is sitting / a man is sitting still / a man sits in a chair
zhLcONtNkew_16_21, a man is playing a card, the man picked up a card / a man is picking up a from the / the man picked up a card from the floor / a boy bends down and picks up a business card / a man picks up a card / a boy is reading a card / a man picks up a business card / a young man bends over and picks up a / a man picks up a business card / a man is picking up visting card / a man is to pick up a card from / a man picks up a business card off the floor / one person take cards / a man picks up a / a man a / a man is picking up a card and looking it / a boy picked up a card from the floor / a man pick up a card / the man picked up a business card off the floor / a man picks up a card / a boy is picking up a card / a boy bends over and picks up a to / the boy is seeing the something / really super video / the man picked up a card for a / a man picking card / a man picks up a / he is looking the car / and / a man picks a card up from the floor / a man picks up a
jcIrD7rNvTM_10_21, a dog is walking on the ground, a three dog walks in its yard / a with three legs roaming in the / dog is playing / a dog with three legs in the field / a dog around on the grass / a three dog walking / a dog with three legs is walking on grass / a dog is walking around / this shows a little three dog doing / the dog talking on 3 legs / a dog is walking in the grass / the dog walked in the yard / a dog is walking in a yard / a black dog is walking on a grassy patch of / a three walks outside / the three leg dog is walking on the grass / the dog is walking on three legs / a three dog is walking / an animal feeding in the field / a dog playing in the ground / a dog walking with his three legs / good / the three dog walked in the yard / a dog with three legs is walking in the yard / a three dog is walking through the grass / a dog walks across the grass / a dog is walking on grass / a three dog is walking through the grass / a dog walks across a yard / a dog is walking around outside / a three dog is walking / a dog walks / the dog is walking / a three dog making his way across the yard / a dog is walking / a 3 dog walks through the grass / a three dog is walking across the grass / a dog walking on grass / a 3 dog is walking / the dog is walking / a pet dog walks on 3 legs / a 3 dog is walking around a yard / a three dog is walking in the yard / a dog is walking in the grass / a dog is walking in the grass / a dog walks through the grass and stops / the dog is walking in the grass / a three leg dog is walking / a three dog is walking around / a three leg dog is searching / a dog is wondering / a dog walking on garden / a dog is walking in grass / a dog with out one hand walk in the farm / a dog with three legs is walking / a dog named who has from / a dog is walking with only three legs
i2GgBwlwV0c_24_31, a person is mixing ingredients in a glass, a woman is making a fruit milk shake / someone is milk into a blender of fruit / pouring milk into a blender with fruit / a woman is making milk shake / milk is poured into a blender / a person is pouring some milk into a blender with / milk is being poured into a blender containing strawberries and / a woman shows how to make a strawberry / food being added to a blender / preparation of / a person is pouring milk into a blender / a great showing to prepare a tasty milk shake / a man making the fresh fruit salad / someone is preparing milk shake / someone poured milk into a blender of fruit / milk is being poured on top of ice cream and / milk is being poured into a blender / someone poured milk over fruit in a blender / someone pouring milk in a fruit mixture glass / milk is being poured into a blender filled with fruit / someone is pouring milk into a blender filled with fresh / a person is pouring milk into a blender / milk is being poured into the blender / a person is pouring milk into a blender of other / milk being poured into a blender / milk is being poured into a mixer / making a fresh fruit milk shake / milk is added to pieces of fruit in a blender / someone is pouring milk into a blender / a woman is preparing fresh fruit milk shake / milk is poured into a glass with fruits and ice / someone is pouring milk into a blender full of fruit / the cook is pouring milk into the blender / a chef is preparing milk shake / a person is pouring milk into a blender full of / milk is being poured into a blender / filling container with milk / milk being poured into a blender / the person is pouring milk into the blender / a person pours milk into a blender / someone making fresh fruit / some milk is being poured into a glass jar containing / someone poured milk over the fruit in the blender / is pouring milk into a jar containing fruits / milk is being poured into a blender
wSwwS_0MKEc_68_78, a girl is drinking, the man drank from a very large glass / someone is drinking from a glass / a small boy dressed as a gentleman is drinking / drinking / a man drinks from a glass / a small boy is drinking / a person is drinking from a / a small man is drinking a large of beer / a boy drinking / somebody is drinking beer / the man drank from a large glass / a man is drinking a beer / a person drinks a beer / a boy dressed as a man drinks beer / a man is drinking his drink / a person is drinking beer from a glass / the little man is drinking beer / a man is drinking alcohol / the little man is drinking beer / a small person is drinking from a large glass / a man is drinking something / these are the is / a man is drinking beer / a man is drinking some water / a drinks a glass of beer / a man is drinking beer / a person taking / the man drank a large glass of beer / a boy is drinking some thing / a man drinks beer / a small man drinks from a big cup / a boy is drinking from a big cup
klFyrnrUSck_79_85, a woman is putting flour on a dough, a man is covering meat with flour / a woman is breading a piece of pork / someone is breading a piece of meat / a person is cooking / the lady dipped the meat in eggs and bread crumbs / a woman transfers some meat from a bowl to a / somebody is something with meat / someone is preparing pork for cooking / how to make video / a person making dish / a woman is putting meat on a tray / the woman is a pork chop / a woman seasons raw meat / someone a pork chop with egg then it / a man cooking his kichen / a person is coating a pork chop with breadcrumbs / a person is breading pork chops / someone dips a pork chop into raw egg and then / a woman is breading meat / someone making a dish in the kitchen / someone is breading a chop / a steak is dipped in egg and then covered with / man showing how to fry meat in egg and breadcrumbs / a man is preparing food / a woman is breading a pork chop / a person is coating pork with bread crumbs / a person is cooking / a woman a slab of pork meat in bread / the lady dipped the meat in egg and flour / a person breads a piece of meat / a woman is breading a pork chop / a person is seasoning a piece of meat / a video on how to make / someone is breading meat / a women making the / a woman is preparing some dish / the person is cooking / someone is breading meat / a woman rubs powder on a cut of meat / a woman is spreading some breadcrumbs on pork / a man coking / a chef a piece of meat / a woman is coating a pork chop / a man is teaching how to make pork / anyone is making dish
fGc6_D0JEIQ_31_46, men are dancing, men are dancing / men are dancing in towels / three guys are dancing / three men dancing with the towel / three men are dancing / three men in towels are dancing / the boys are dancing / three men are dancing outside / three men are dancing in beach towels / men are dancing on bath towel / three young men dancing with their towels / three men wrapped in towels are dancing / three friends doing some sort of towel dance on a / three boys are dancing in towel / the is dance / super three dancers / a group of three guys doing what looks like a / the boys are dancing with towels on / three men dance wearing towels / three men are dancing / three guys are dancing / three men are doing same dance in the street / three guys dance in the street / three men are dancing / some boys are dancing / three young men are dancing / three people dance in towels / the friends doing some sort of funny towel dance / the boys are dancing / a boyes funny dancing on the / the boys danced in their beach towels / three boys are dancing in the rain / three boys are dancing / three man dancing / three boys dance / the three boys are dancing / some boys are dancing / men are dancing / three guys are dancing / three young men dressed only in towels are doing a / three men are dancing in the street / three men are dancing / the three boys danced in the sand with their beach
msCidKHOh74_410_418, a man is riding a motorcycle, the man rode his motorcycle down a dirt road / a man is riding a motorcycle / a man is riding a motorcycle / a short clip from the movie dhoom showing john / the man is riding a motorcycle / a boy is driving his bike / is riding a bike / a man rides a motorcycle / actor riding a bike in the movie / a man rides a motorcycle across a field / a man driving a very big bike with lots of / a man is riding bike on grass / john in an action scene trailer from a movie / a man is riding a motorcycle / a man is riding a motorcycle / a man riding a motorcycle / a man rides a motorcycle / indian actor john rides a motorbike with luggage on / john dhoom scene to chases / the person is going on the bike / an indian actor riding the bike in very high speed / it is the scene of the film dhoom part / a man rides a motorcycle / he is a racing / the two groups fighting with each other / a man riding on the motor bike / a man is riding a bike / john riding bike in movie / a man is riding a bike on the ground with / a man is riding on the bike / a man with a backpack rides a motorbike on a / a man is riding a motorcycle / a man is riding a motorcycle / this video is a short of bike chase scene / a man is riding a motorcycle through a field / a man is riding a motorcycle / a man is riding on a motor bike / a man wearing a backpack is riding a motorcycle / someone riding a motorcycle / a man is driving a motorcycle / a guy is sitting in the middle of the road / a man is riding a bike / a man driving a motorcycle / a man is riding a motorcycle / a guy is sitting in the road / a man is riding on a bike / someone is riding a motorcycle / a man is riding a motorcycle / a man is riding a motorcycle / the man rode his motorcycle down the dirt road
pNelR-nHz7g_68_90, a man is slicing some meat, cutting chicken into pieces / preparing food in hotel / a chef is cutting chicken / a cooked duck being finely cut / the cook is slicing up a cooked chicken / a cooked bird is being cut / a man slices portions of meat from a roasted bird / a chef is slicing / someone slicing roasted duck with knife / a man slicing the roasted duck / the chef is slicing the top layer of the roasted / the cook is slicing the duck breast / a man is meat with a knife / a person is slicing small pieces from a cooked duck / chef is slicing the pieces of roasted duck / chopping meat / a cook is cutting a meat / a man is cutting some pieces of roasted meat / a man slices chicken / chef chicken breast / a man is removing cooked pieces from a chicken / a chef some meat / a chef is slicing breast meat off a roasted chicken / a man is poultry / a man is cutting thin slices from a whole cooked / the man cutting / a chef cutting a cooked duck / a chef is slicing poultry / a chef is finely slicing baked chicken / slicing the fried hen into small pieces / the chef is slicing the meat of the roasted chicken / a chef a roast / a man is cutting poultry / a person is slicing meat / a man is slicing some pieces from a roasted chicken / person a cooked or bird / a chef is cutting chicken piece / a chef is slicing a roasted chicken / a chef cuts up a / a man is slicing chicken / a man a duck
wjH72cZ0GLM_1_10, a man is pushing a car, a man is pushing a car / a man is pushing car / the man is pushing the car / the man pushed the black car / a guy is pushing a car / a kid is pushing a car / the man is pushing a car / a man is pushing a car / a man is pushing car / a man is pushing a car / a man is pushing a car across a parking lot / a man pushes a car / a person is pushing a car / a man is pushing a car / a man pushes a car / a man is pushing a car / pushing the car / a man is pushing a car / the person is pushing the car / a man is pushing a car / the person is throwing the car / a man is pushing a car / a boy is pushing the car / pushing the car / a man is pushing a car / a man is pushing a car / a man pushing a car / a man is pushing the rear end of a / a man is pushing a black car / a man is pull a car / a man is pushing car / a strong man is a car / a man is pushing a car across a parking lot / a man pushes a car by himself / the man pushed the black car / a man is pushing a car / a young man pushes a car / a man is pushing the car / a guy is pushing a car / a man pushing all his to push a car
