kWLNZzuo3do_25_32, a woman is slicing a vegetable, a woman is cutting coriander leaves / a man is slicing some vegetables / she is the cutting the leaves / chef is boiling vegetables / a woman is chopping some herbs / a woman is chopping herbs / a woman is cutting a green leafy plant into small / a chef is slicing herbs / a woman is chopping up some herbs / a woman is cutting coriander into pieces / a woman cuts / a person is slicing / people are slicing vegtables / a chef slices and then begins to open a / a woman is cutting a green leafy plant into small / the woman is cutting / a person is cooking / someone is cutting herbs / a delicious looking dish attractively displayed / a woman is cutting herbs / a woman cuts up a leafy plant / a woman cuts up a green plant / a woman is cutting / a woman is chopping some / a lady cut up greens / a women is making the food with her dog / someone is chopping up some herbs / a woman is cutting the stems and leaves of an / a woman is cutting a green vegetable with a knife / a woman is cutting vegetables / a man cooking his kichen / a woman cuts up / a woman is chopping / the cook is slicing / a man is cutting coriander leaves / a woman is chopping coriander / a woman cuts up some / a chef chops some herbs / a woman is chopping vegetables / a person is cutting the noodles / a person is making noodle / a chef cutting coriander into small pieces / a woman is cutting herbs / the person is cutting the leaves / someone is slicing vegtables / a woman is slicing some vegetables / a cooking place / a woman chops the stems and leaves of an / a man is cutting a some leaves / a person is cutting / a woman choped leaves / a delicious dish attractively served / on cooking with a dog showing how to make / a woman is saying about how to make the / a woman is cutting vegetables / a woman is chopping / a woman is chopping up / a person coking / a person with a knife is cutting a green vegetable / the lady cut up the greens / a woman is cutting some herbs / someone cut up greens / somebody is cutting some green leaves / making noodle / a lady cut up greens / good detail for noodle video / how to cook / someone is cutting herbs / a telling the racipe for making the noodle / a man is chopping leaves / a woman is chopping an / a person is cutting coriander / the woman is slicing / a person is chopping / a person is cutting leaves
ok4cM6WTA5E_178_184, a man is adding ingredients to a pot, someone is pouring pasta into a pan of sauce / pasta is being added to a pot of sauce / is being cooked / a person is pouring plain pasta into a pot of / someone pours noodles from a into a pan / someone making a dish in the kitchen / the person is cooking the something / the lady added pasta to the tomatoe sauce / the man is pouring pasta into the pot / someone is putting noodles into some sauce / a man cocking / a man dumps pasta into a bowl / a person is putting pasta in a pot / a man adds pasta to some sauce / pasta is poured into a pot / someone is pouring noodles into a pot / a man drops pasta into a bowl / a chef pours noodles into a pot / someone is adding pasta to a pan / the person is cooking something / a woman is pouring pasta into sauce / someone is cooking / a man is adding pasta to a pot of sauce / pasta is added to sauce in a pan / a man is cooking some thing / a man is dumping pasta into a pot / a person pours pasta into a pot of sauce / a person is pouring noodles into a pot of tomato / racipe for making some food / a man is pouring pasta into sauce / a person puts pasta in a bowl / a man is pouring noodles into a pot / pasta is being prepared by putting it into a bowl / a man is making pasta / a man is making / a man adds hot boiled to a vessel containing / the person is adding pasta to the bowl / a man is cooking
f9_bP219ehQ_63_70, a man is talking, a man speech in the / people were in tea party / a man to a crowd at a tea party / tea party / a man is speaking on a microphone / a man talks / a man talks into a microphone / people are in one place / a man giving a speech to the peoples / a man is on / a man is speaking into a microphone / a man is giving speech / an oldman is speaking / a man is speaking into a microphone / a man is speaking / an older man speaks into a microphone / a man talks into a microphone / a man being interviewed at a park event / the man spoke at a rally / a man is talking / a man is speaking about a / a man is speaking to an audience / a man is giving a / an old man is speaking through the mike / a man speaking to a reporter / a man is talking into a microphone / a man is speaking to a crowd of people / a man is talking to the crowd / a man is giving interview / a man talks into a microphone / a man is speaking into a microphone / n old man is talking to the crowd / the person is speaking something / an elderly man is giving his a / a man is speaking in front of a group outside / a man is talking / the man spoke at a rally / a man is talking / tea party is giving a speech / a man talks into a microphone / the man is speaking to an audience / a man speaking something in a mic during a tea / a men give the interview / the old man is being interviewed / a person speaking their / a man is talking
zS50h-a8RTg_3_9, a man is swimming in a pool, the man dived into the pool from the wall / a boy dives into a swimming pool / a boy is diving into a pool / a person taking bath in the water / a young man dives off of a wall into / a man dives into a pool / a man is diving into the water / someone is diving into a pool / a boy jumped into a swimming pool / a man dives into a pool / the man into the pool / a man is diving into a pool / a man is falling into the water / a guy diving into the pool / a man is diving in to the pool / a person is jumping into the water / a man swim in the swimming pool / a men is jumping in swimming pool / a man swimming in the pool / the man dived into the pool / a man dives in to a pool / a person is jumping into the swimming / a man dives into a pool / the man into the swimming pool / a man is diving in the swimmingpool / a man dives into a pool / a man is jumping into the swimming pool / a man is jumping into a swimming pool / a man dives into a swimming pool / this video shows a man diving into a pool / a man dives into a pool / a man swimming in a pool / a boy dives into a pool / someone is jumping into a pool / a man dives into a swimming pool / a man is diving into the water / the person is swimming the water / a man dives into a pool / a man dives into a swimming pool / a man dives in the swimming / a man dives into the pool / a man dives into a pool / a man dives into a pool
xxHx6s_DbUo_202_207, a man is running, a man is punching and kicking a dummy / a man is boxing with the tree / a man is kicking and boxing with a punching bag / a man is punching and kicking / a man is kicking and punching a target / the person is boxing / a man is punching a large stick / a man is boxing and kicking something / a man is practicing boxing / a man is punching on tree / a man using a punching bag / the man is practicing boxing / a man is beating up a dummy / the man boxed at the pole / a person is practicing / a man is punching a post / a man a pole while other people watch / the man boxed at the dummy pole / someone is punching something / a man is punching something / the man is at a dummy / a man is a post / a man is punching something / strugling for live / a man is punching and kicking a dummy / a man is boxing and kicking a stick while / the man practiced martial arts on the dummy / a man doing boxing / a martial artist practices with a dummy / a man is punching a target / a man is practicing / the boy is doing the excising
yyxtyCaEVqk_329_360, a man is putting cheese on a cucumber, a man is adding wine into the carrots / a man is preparing something / a man is sprinkling black paper on carrot pieces / a man is preparing a side dish using carrot / a person is sprinkling seasonings on a pan of carrots / a man slicing vegitable / one man something on potato / a man is mixing carrot / a man demonstrating how to carrots / a man preparing carrot for side dish / seasonings are being onto some sweet potatoes / a man sprinkling some kind of salt on the / a man is sprinkling dried herbs onto carrot sticks / a man cutting the carrot / a man is seasoning carrots / a man is adding pepper to sliced carrots / in this we how to food / seasoning is sprinkled over prepared carrots / a man is sliced carrots / the chef sprinkled seasonings on the carrots / a person seasons carrot slices / a man sprinkles some and then on top / somebody is mixing something in carrot / a man is putting spices over carrots / a man is seasoning some carrots / cooking with jack show demonstrating how to make a lazy / dried and are sprinkled over the tray of / a man is sprinkling and to a bunch / a guy is slicing the carrots / a man is sprinkling spices on carrots / a man seasons some carrots / a man pours some spices on a pan of carrots / the chef seasoned the carrot sticks / a person is pouring seasoning on to a tray of / a man is sprinkling herbs over some carrots / a man spices onto carrot sticks / someone sprinkles spices on carrot sticks / a man is seasoning cut carrots / a person seasons carrot slices / a man is putting seasonings on sliced carrots / a man seasons a tray of carrots / the man is seasoning the carrots / someone is seasoning some carrots / lazy mans side dishes / a man sprinkles some seasoning on carrot slices / a man is slicing the carrots / lazy mans side dishes / a man adds seasoning to carrot sticks / man adding spices to the carrot / a man is using spices on carrot sticks / a man is putting in to the carrots
jLgmCY1fEE8_16_26, men are playing on the beach, people are running on a beach / a man is leading two girls wearing to meet / people are in sea shore / running down the beach / criss trick / a man two ladies standing by the beach to / two people are walking and talking on the beach / a set of people were sat on the beach / angel is people on the beach for help / three people are walking across the beach / a man is talking to a group of people / a man is talking to people on the beach / a man runs with women on a beach / the man brought two girls to his group on the / a man is female at a beach / angel / people are talking at the beach / some people are enjoying near the beach / a criss magic / the women s is doing the running race / criss angel talking to three women / people enjoying at beach / criss angel talks to women on the beach / a group enjoying on the seashore / criss angel beach trick / a person sitting on a beach and admiring the view / a man 2 women to his group on the / angel does magic tricks on the beach / a man and two are runing on beach / a at the beach for his magic / criss angel people on the beach for a trick / a man is running with two women / all people are moving around in a beach / lots of person is doing fun on beach / a man is running two ladies / woman on the beach / a man and two women walk across the beach / a man is talking with two women s / a man gets two women to walk with him on / in the beach / the man is talking to women / criss angel performing some magic trick with beach girls / a man is talking to women on the beach / angel women on the beach / a man and two women are walking down the sea / the person is about beach tricks / a man is talking with other women on the beach / a man and girls walk on the beach / two women on the beach someone to a group / the man is walking with women on the beach / the peoples are running
n_Z0-giaspE_437_447, men are dancing, men giving some kind of demo of dance and sports / a group of boys are dancing / three guys perform a dance routine / three men are doing a presentation / a man is standing in front of a room of / three boys are dancing / three men start dancing in front of a class / the two men did a funny with a boxer / two men are dancing and one man in the center / boys are dancing in front of people / boys are dancing in a class / two guys dancing while the guy in the middle showing / three boys are dancing / a young man wearing boxing is by two / three people dance / three men perform for a crowd / three men are performing before an audience / men are dancing / three boys are dancing in the class room / the men the boxer / three men are dancing in front of a crowd / three men are dancing / three men fighting / three men are dancing / guys are performing / three boys are dancing in front of a crowd / three boys are dancing / the men are performing in front of people / camp
yYA7YXIKbg4_9_14, a dog is playing, the lady and her dog walked on the treadmill / a dog is running on running pad / a dog is being walked on a treadmill / a dog is walking in treadmill / a dog is walking on a treadmill / a dog is walking on a treadmill / a is walking on a moving treadmill / a dog is on a leash walking on a treadmill / a dog is being walked on a treadmill / the dog is walking the treadmill / a dog runs on a treadmill / a dog is running / a dog is walking on a treadmill / workout video / the dog is doing the something / a dog is walking on a treadmill / a dog is doing exercise / a dog is walking on a treadmill / a dog is running on a treadmill / a dog on a leash and a woman are walking / a person is walking her dog on a treadmill / the dog is using the treadmill / the lady and her dog walked on the treadmill / the dog is running / a dog is doing workout / doggy the gym / a dog is playing / a dog is walking on a treadmill / a person exercising with a dog / a dog is walking on a treadmill / a dog is doing workout / the lady and her dog walked on the treadmill
htWPOGTagec_2_18, a boy is playing a keyboard, a boy is playing a keyboard / a boy is playing a keyboard / a boy is playing the song / the boy play the piano and sing the tamil song / a boy is playing keyboard / a boy is playing instruments / a boy is playing the keyboard / a boy plays an indian music on a musical instrument / a little boy is playing a keyboard / a boy is playing piano / a little boy is playing an electronic keyboard / the boy is playing the keyboards / a kid is playing with a keyboard / a young boy plays a keyboard / a small boy playing on a key board / the young boy is playing the keyboard piano / a kid is playing a keyboard / a small boy standing plays the tune of a song / the little boy played a keyboard / a boy is playing a piano / the child is playing a piano / a boy is playing key board / a kid is playing piano / a boy is playing keyboard / the little boy with the keyboard / a boy is playing musical instrument / a young boy playing a keyboard / a small boy playing piano / a boy is playing the piano / the boy is playing the key / the little boy played with the keyboard / a boy is playing a keyboard / a boy is playing a piano / a little boy is playing a keyboard / a boy is playing a keyboard / a boy is playing keyboard / a boy is playing an electronic keyboard / a young boy is playing on an electric keyboard / the boy is playing the keyboards / a boy is playing on an electric keyboard / a kid plays with a piano / a kid is playing a keyboard / a boy plays an electronic keyboard / a boy is playing the piano / a boy playing a guitar / a little boy is playing a keyboard / a boy is playing piano / a kid plays the keyboard
qeKX-N1nKiM_133_142, the person is cooking the something, a lady is preparing food / a woman is frying something / anyone is making dish / japanese food is fried / a person is cooking / an asian chef is frying seafood / someone is frying stuff / a person is making / the woman is frying vegetables / a person is and frying food / a person fries / the lady added the batter dipped shrimp to the oil / the woman is frying pumpkin / a woman is coating vegetables in a bowl of flour / vegetables are being deep fried / a person is placing ingredients in hot oil / the lady dipped the fish in batter before putting it / a person breads a vegetable and puts it in a / the person is cooking the something / sliced vegetables are dipped in batter and deep fried / a person is dropping food into a pot / the lady added the batter dipped food to the hot / a woman is frying food in a pot / a man cooking his kichen / a person is frying food / a woman is putting vegetables in batter and then deep / a person is frying / in this video cook / a man is placing vegetables in a pan of / a woman is coating a small piece of something in / a person is making the tasty japanese food / a man is cooking using hot oil / this vidio shows that how to make / someone is frying something / a cook puts some vegetables into a pot / cooking the japanese food / someone is putting vegetables into hot oil
ybVb3t560oY_0_9, a man is running, rabbits and hens are fighting / two chickens are stopping a rabbit fight / rabbits and chickens are fighting / we stop fighting you both / the rabbits and chickens fought together / one rabbit chases another and then two chickens and / rabbits and chickens are fighting / two rabbits are chasing each other when they are attacked / two rabbits are fighting / some animals are each other / two rabbits were fighting when they saw hens the rabbits / two rabbits are fighting / the animals are fighting / two rabbits are together when they are attacked by / two rabbits are fighting with each other as two hens / two chickens stop a fight between two rabbits / two chickens attack two rabbits / the rabbits and hens are fighting / two rabbits and chickens are playing / very cleaver chicken police / the chickens are fighting the rabbits / chickens are attacking rabbits / two chickens stop rabbits from fighting / hens and rabbits are fighting / two rabbits and two get into a / chickens in a high speed bunny chase / two hens trying to catch out the rabbits playing in / two animals chasing each other / the rabbits and chickens fought together in the yard / the rabbits are running and jumping / a white rabbit trying to catch black rabbit / the animals are fighting / rabbits and chickens are fighting / two rabbits are fighting / chicken playing / two rabbits running and a hen fighting with them / two rabbits and two chickens are playing / two chickens stop two rabbits fighting / animals are playing / two rabbits are playing / a chicken attacks a bunny
vE1gvaM3iAs_39_46, a man is putting a plastic container in a, a man cleans a / the person is showing how to remove scratches on / a man is cleaning a / someone is cleaning a / a man wipes a / a man is cleaning a / a man wipes a / a man is removing scratch from / a man is cleaning a / a man is removing scratches from / the person is cleaning the / a man wearing surgical is applying a paste cleaner / a man giving demo how to remove scratch from / a man is cleaning a / a person is cleaning a / how to remove scratches from / an illustration of how to clean a scratched / a man removing scratches from a with some sort / removing the scratches from the / the man cleaned up the / a man is removing a coating of and peanut / a man is wiping a / a man clean the / a individual wipes off a / the person is cleaning a / someone is fixing a video / a short and clip about how to remove scratches / someone is cleaning a / a man is wiping a with cloth / a person is cleaning / a person is cleaning a / a person is cleaning a / the lady cleaned a / someone is wiping something off of a with a / a guy is cleaning a / a person is cleaning a / a man is cleaning products to remove scratches off / a man cleans a / a person is a with a paper
s8utHZYTNTs_35_42, a man is making a paper, the man cut a out of the red paper / someone is cutting a piece of paper into a circular / a person is cutting some pink paper / a person is cutting a circle in pink paper / someone is cutting a circle out of a pink sheet / a person with scissors is cutting a circle of pink / the lady cut a circle out of red paper / a man cutting a paper in round shape with scissors / someone is making a paper / a person is cutting a piece of paper / a person cuts a circle from paper / the person is using scissors to cut paper / the person is cutting paper / somebody is cutting a paper / a person is cutting a piece of pink paper with / a woman is cutting a paper with a scissors / a person cuts a pink paper / a person cuts some paper / a woman is cutting a piece of paper into a / the person is cutting the paper / someone cuts a circle out of a piece of pink / a person cutting a paper / anyone is cutting paper / someone is cutting paper with scissors / someone is cutting a piece of paper / someone is cutting a piece of paper with scissors / a person is cutting a piece of paper / a woman is cutting papers
u4kMN1jamdM_10_20, a woman is riding a horse, a woman is riding a horse along a beach / a woman is riding a white horse on the beach / the man led the girl on the white horse / a woman rides a white horse on the beach / the lady is riding a horse / a girl is riding a horse on the beach / a woman horseback riding along the seashore / a woman is riding a horse on the beach / a woman is riding a horse / a woman is riding a horse / a woman is riding a horse / a woman is riding on a horse in a beach / the woman is riding a horse / a woman is riding a horse / a woman is riding a horse on the beach / a woman is having a ride on the back of / a woman riding a horse / a woman riding a horse on the beach / the man is leading a girl on a white horse / a woman rides a horse / the woman is riding a horse on the beach / a woman is riding a horse / a woman riding a horse on the beach / a woman is riding a horse on the beach / a woman riding a horse / a girl is on a white horse at the / a man is helping a girl to ride a horse / a girl is doing horse riding / a horse ride on the sea shore / a girl is riding on the horse / a woman is riding a horse / the boy led the girl on the white horse at / a girl riding a white horse / a woman is riding on a horse / a woman is riding a horse / a woman is riding a horse on a beach / the man led a girl on a horse at the / a woman is riding a horse / a woman rides a horse / a woman riding a horse / a woman is riding a horse / a woman is riding a white horse on a beach / a lady is riding a horse / a woman is riding a horse on the beach / a girl is riding on the horse / a woman rides a horse on a beach / a woman is sitting on a horse / a woman is riding a horse / a woman is riding a horse on the beach / a woman is riding on a horse / horse riding / a girl is riding a horse
t8Nf1MK7lts_0_10, a man is pointing guns, the man s in uniform / all are people wearing full metal jacket / a is speaking to a line of soldiers as / a drill yelling at his men / an army man is giving instructions / an instructing in a boot camp / a drill is talking / a drill his / the drill is talking to his men / a man is putting down / a man is talking to / an to his / a drill is speaking to some soldiers / a drill is a / minutes of boot camp / a is his men / a drill is over his / a drill walks in front of his / a drill is instructing his men / a police men is giving speech / a soldier walks through a and talks / a is his / the the / an giving instructions / a drill is walking / a drill talks to his / full metal jacket minutes of boot camp / the military barked at the / a drill yells at his / an is giving order to his / a military is a group of men / very foot camp / a man is talking to a group of soldiers / an is talking to / a military is instructing / an army is walking and talking to a line / a man is talking / a drill is talking to a line of soldiers / an army discussing and giving some sort of instructions / an army drill inspects his / a drill is speaking to soldiers standing in / an is talking to his / a people in the / a man is talking
wkgGxsuNVSg_34_41, a man is running, the animals a doing very funny things it is / a child playing / a little kid was afraid of the fish he had / a young child is running around in circles trying to / the kid is afraid of the fish / a child is away from the fish / a little kid is running around a fishing pole / a kid is playing near pond with a stick / a kid is playing with a caught fish / funny video / a baby is running / a small kid the fish at one end of / a child is trying to get away from a fish / a kid runs away from a fish swinging around on / the little girl ran away from the fish on the / a boy holding a fishing pole is running in circles / a child is playing / a kid is holding a fishing pole / a child runs around a fishing pole / the baby is playing / a child is playing / the boy is afraid of the fish / a girl is looking at the flock of ducks / a child is running around a fishing pole / a fishing is chasing a boy / a boy is running forward to the fish / a little boy is running away from the fish he / a boy is running in front of fish hanging on / a little boy has a fishing rod in his hand / a boy is running fish on a string / a child is running from a fish / a child is running from a fish on the end / funny home video of a boy running from his own / a comedy compilation / a man is swinging / a boy runs away from his fishing line / a child is running from a fish / a child is rounding with the fishing rod
