sBjr8UJOpsQ_149_169, three men are dancing, a couple are dancing near a water falls / two people are dancing / a man and woman are dancing outside / a man and a woman are dancing in front of / a man and a woman is dancing in the water / a man and a woman are dancing / a man and a woman are dancing in the rain / a hero and the heroine are dancing for the song / a man and woman are dancing near a / a man and a woman are dancing near a / two people are dancing / the man and woman are dancing / a man and woman are dancing near a / the couple danced by the / a man and a woman dance in front of a / the women is playing in the rain / a young couple singing and dancing / one couple is dancing / a couple are dancing near a / dance in the rain / hero and are dancing in a song sequence / a man and woman dance in front of a / a couple playing in rain / a man and a woman dance beside a / the dancers danced by the / and were dancing / a man and woman are dancing / a man and woman are dancing / two people are dancing in front of a / a man and woman dance near / a couple are dancing / a man and woman are dancing in the water / two people are dancing / the man and woman are dancing / the couple are dancing / a couple is dancing
rl1rVk_xIOs_1_16, a group of men are dancing, a baby is dancing / a little boy is dancing / children are dancing / a young toddler is dancing / a toddler dances with a group of kids / some children are dancing / some kids dance around / some children s are dancing / the children are dancing / baby is super / a baby is dancing / kids are dancing / a little boy is dancing / children dance / a toddler dances in a gym / the little boy danced at the wedding / several children are dancing / several kids are dancing on a basketball court / a few little girls and a little boy are dancing / the little boy danced on the gym floor / little kids are dancing at a wedding / the baby is dancing / a little boy is dancing along with other kids / children are dancing / some small baby dancing / children are dancing / kids are dancing / a group of children are dancing / a baby is dancing / a group of kids are dancing / children are dancing / a very young child is dancing with some older children / children are dancing / the dancing baby / a girl is dancing
wFX6bXLbHW4_83_90, a man and woman are talking, a movie named as 9 from outer space trailer / the man tried to shoot the / the man is shooting a gun at the / two men are shooting at a / shoot the man / some persons are fell down / a man wearing a black is walking toward a / the man shot the with a gun / was very bad / are shooting a man / a man shooting an another like a ghost with his / a man is firing another man / a man in a black a to / 9 from outer space / a man is shooting another man / a man shooting / the man is shooting the / a man sprays a at another man / a man is shooting another man with a pistol / two men are shooting a man / when did they this classic this i like / a man is shooting another man / a man shoots a man / a man is walking / the person is shooting the another person / a man is being shot / a man shoots a pistol at a monster / a man shooting other man / a man with a pistol shoots another man
oFUsn1owAbs_158_168, a woman is dancing, a woman is taking a bubble bath / featuring a girl taking a bath / a woman is taking a bubble bath / a woman is taking a bubble bath / a woman is bathing in a tub / the lady played with the bubbles in her bubble bath / is taking a bubble bath / a girl is taking a bubble bath / the woman is taking a bath / the lady enjoyed her bubble bath / the lady enjoyed her bubble bath / the women is bathing / a women taking bath in the bathtub / something weird bubble path / the woman is taking a bubble bath / a woman is bathing / a woman is taking a bubble bath in a large / a woman is taking a bath / the woman is taking bath / a woman is taking a bath / a lady is taking bath and her body is full / a woman plays with her bubble bath / a woman in a bath plays with bubbles / someone is playing in a bubble bath / a woman having a bubble bath in a bathtub is / a woman is taking a bubble bath / a woman is bathing in a bathtub of bubbles / a girl is bathing / takes a bubble bath
n_Z0-giaspE_168_193, two men are fighting, three men are doing karate in a field / three men are karate / three men are doing karate / men are doing martial arts / three men are doing karate / the boys did martial arts together in the field / a few guys are fighting each other / the men did martial arts together in the field / some boys are doing martial arts / three boys are doing martial arts / three boys / a man himself from two with martial arts / two guys fighting / the men are fighting / the men are fighting using martial arts / two men are fighting / two men are fighting / three guys are karate fighting / three men practice martial arts / the boys are doing the fighting / men are fighting in a field / two men are fighting / three boys are doing karate / three men are practicing karate moves in a field / kids karate fight / three men are practicing martial arts / two boys are fighting one / three men are doing karate / the boys did martial arts together / three men are fighting in a field / three boys in karate costumes are fighting / three men are doing karate / three persons are doing karate / three guys have a martial arts fight / two man doing some sort of karate practise in a / three men are doing karate moves in a field / the three persons are fighting with
s0hwEUC5emA_127_132, two women are talking, a man shakes a womans hand / a man shakes a womans hand / the person is doing the something / a man and a woman are shaking hands in a / a man and woman shake hands / a man and woman shake hands with each other / a commercial about an in india / a women a man / a man and a woman are shaking hands / an old lady shake hand with man / the man and woman are shaking hands / a man and woman shake hands / a man and woman are shaking hands / a young man meets an older woman / a woman shakes the hand of a man at the / an old lady is shaking hand to the young man / the man and woman are shaking hands / a man is shaking a womans hand / a man is shaking hands with a woman and talking / a man is shaking hand with a lady / two people are shaking hands / a man and woman each other and shake hands / a man is speaking with an another girl / a man and a woman shake hands / a man is shaking a womans hand / the lady the man outside / fur very good / a man and a woman shake hands / a man and woman are shaking hands /  / the lady came out to the man / a man and a woman are talking and shaking hands / an old woman is shaking hand with a man / an old lady is talking / a woman giving shake hand to a guy
j4dMnAPZu70_11_18, a panda is playing, panda babies are playing / panda bears are playing on a slide / a black and white baby panda / a baby panda slides down a slide / a panda slides down a slide / pandas are playing / a baby panda goes down a slide / panda is sliding on the slide / a playing panda / a panda cub is sliding into the snow / some baby pandas are going down a slide / polar bear is playing / the panda babies is sleeping / the panda bears slid down the slide into the snow / the panda went down the slide / panda bears are sliding down a slide / a panda / a panda baby rides a slide / the bears slid down the slide / a panda slides down a slide into the snow / a baby panda slides down into the snow / panda bears play in the snow / a panda is sliding down a slide / a panda bear sliding down a slide / a panda bear is sliding down a slide / playing panda babies in the ice / this is panda babies / a baby panda is going down a slide / the panda sleeping / panda babies sliding and having fun / the panda went down the slide / a panda bear slides down a wooden slide / the panda babies playing
xxHx6s_DbUo_57_61, a man is doing something, the man is exercising / a man is doing exercise / a man is exercising / a man is doing pullups from a door / a person exercising / a man doing a pull up exercise / a man is doing pullups / a man is doing pullups / the man did in the doorway / the man did in the doorway / a man does in a doorway / a man is doing pull ups / the man did chin ups on the door / someone is exercising / a man is doing pull ups / a man is doing exercises / a man is doing exercise / a man is doing pullups in a doorway / the person is doing the something / a man is doing pullups / a man is doing pull ups / tamil song / a man is doing pull ups / the man is exercising / a man is exercising / a man is exercising / look at my face in the mirror pawan kalyan
g36ho6UrBz0_5_20, a man is playing a guitar, a man is playing a guitar / a man is playing a guitar / a man is playing a guitar seated outside a restaurant / a man is playing the guitar / a man is playing a guitar / a man is playing the guitar / a man playing a guitar outside his house / a person is performing with his guitar / an old man is playing guitar / a man is playing a guitar / a man plays the guitar / a man is playing an electric guitar / a man is playing a guitar / the man is plying his guitar on the patio / a man is playing a guitar outside / a man is playing a guitar outside / a man is playing a guitar / a man is playing a guitar / a man is happily playing guitar / the man is playing music on a guitar sitting on / a man is sitting outdoors playing an electric guitar / a man playing his electric guitar at a home party / a man playing an instrument / a man plays guitar / a man is playing a guitar on the patio / a man is enjoying himself as he plays the guitar / a man is playing a guitar outside / a band is performing on a stage outside / the man played his guitar at the party / a man is playing guitar / a man is playing a guitar / a man his guitar on his patio / a man plays a guitar / a man is playing guitar outside of a store / a sitting man is playing guitar / a man is playing a guitar / a man playing electric at a party / a man is playing the guitar / a man plays a guitar / a guy is playing guitar / a man is playing guitar / a man is playing the guitar / a man playing guitar / a person is playing guitar now / a man is playing an electric guitar outside a home / a man is playing a guitar while sitting down / a man is playing guitar / the man played his guitar / he is playing guitar and not in any drink / the man is playing the guitar / a man playing a guitar / a man is playing violin / a seated man plays guitar / a man is playing an acoustic guitar outdoors / the man is playing the guitar / a man is playing a guitar / a man playing the guitar / a man playing guitar / a man is playing music through fiddle / a man is playing a guitar / the man is playing the guitar
fcvW1vr8hAs_96_102, a man is playing a guitar, the man held his guitar and pet the two dogs / a man with a guitar is petting two dogs / a man sitting with dog / a man is petting two dogs / a man pets his dogs / a man is singing / a man is petting two dogs / a man is singing and stroking dogs / a man is play with pets / someone is petting dogs / a man is playing with dogs / a man is petting two dogs / a man is holding a guitar in his right hand / a man is singing a song / a man saying about dog / song with a guitar / a man sitting on steps with a guitar is petting / a man playing with two dogs and a guitar / a man playing with dogs / a man is petting two dogs / a man is petting two dogs / a man is petting two dogs while holding a guitar / the man pet the two dogs while holding a guitar / a man pets a dog / a man is pampering his dogs / a man holding a guitar pets 2 dogs / a man is petting some dogs / a man pets a couple of dogs / a man is sitting on the front steps of a / the man is petting the dog / a person with his dogs / a man is petting two dogs / the man is petting the dogs / the two dogs show there affection and the man is / a man holding a guitar is petting two dogs / a man is petting two dogs / the man pet the two dogs / a man pets some dogs / the man and the dog / a men is give the love of his dogs / a man with a guitar is petting a dog and / a man is petting two dogs
iarsmqA3dck_19_25, a cheetah is running, a tiger runing / a tiger is running very fast / leopard is hunting the dear / the cheetah is running / a cheetah is running across a field / a cheetah is running / are wondering / a cheetah is sprinting across a field / a cheetah runs across a field / a attacking on gazelle / a cheetah runs through a field / a cheetah is running at / a cheetah is running / a group of are eating the grasses / a cheetah is running very fast / a cheetah is running through a field / a cheetah is running / a cheeta running very fast / a is cheetah running / the cheetah raced after its prey / a cheetah is running in the grass / a cheetah is running / a cheetah is running / a cheetah is running / a cheetah is running / a cheetah attacking the gazelle / a cheetah is running / in this picture we that is wide tiger hunting / a cheetah runs full speed across a field / a cheetah is running / a cheetah is running at great speed on grassland / a cheeta is running in a field / a group of gazelle is attacking by the cheetah / a cheetah is running / a cheeta running in the forest / a cheetah is running quickly / a cheetah is running / the cheetah is running / a panther is running fast on the grass field / the cheetah raced to catch his prey / a cheetah is running very quickly / a cheetah is running across a field / a cat through a field / a cheetah runs at speed / cheetah is running / one tiger attack gazelle at the speed of / a cheetah is running to catch the gazelle
kRNHJSc4AXE_220_228, a man is dancing, a woman is dancing in the rain / i will dance until the rain stops / a woman is dancing in the rain / a woman is dancing in the rain / a woman is dancing in rain / a woman is dancing by a large tree in the / the girl danced in the rain / all girls dancing / a girl dancing in the video song / a woman is dancing in the rain / a woman is dancing in the rain / a woman is dancing / people are dancing / a woman in india dancing in the rain / a girl is dancing in the rain / the song / a woman is dancing in the rain / a woman is dancing in the rain / a girl is dancing in rain / a girl is dancing in rain / the woman is dancing in the rain / a lady dancing in rain scene at movie / the lady danced in the rain by the tree / a woman is dancing in the rain / a woman dances in the rain / a woman is dancing in the rain / a woman dances in the rain / a woman is dancing in rain / a woman is dancing in the rain under a tree / a girl is dancing in rain / a woman is dancing in a large tree in the / a woman is dancing in the rain / the girl is dancing the water / a woman is dancing in the rain / is dancing in the rain / the woman is dancing in the rain / an actress is dancing in the rain / very very super song dancing very well / the lady is to we dance / a lady ran and dancing in the rain
rw9h_574HxE_161_166, a man is talking, a heroine is taking bath in the film sequence / the lady took a shower / a woman her hair back / a woman is standing in a shower / a woman is taking a shower / a woman is showering and the scene flashes to a / a woman is showering / women is bathing / a woman / a woman is taking a shower / a woman is bathing in the rain / a women is taking bath / a woman bathing in the rain / a woman washes herself in rain / a woman is bathing / the woman is taking a shower / a woman is bathing in a shower / in a movie of an indian / a woman is taking bath / a woman is showering / a woman wipes the rain off her face / a woman is showering / two lovers are singing and dancing / a woman is showering / the woman is taking a shower / a woman is in the rain / a woman is taking a shower / a girl is bathing / a woman is having bath / the lady / the woman is taking bath / a woman is standing in the rain getting wet / a woman is taking a shower / a girl is getting wet / a person is both
kquB3rIgfGk_640_645, a man is talking, a man drinks something / a man drinks from a glass / a man drinks a glass of water / the person is making omelet / a man drinking the water / a man coking / a man drinking water / a man drinks a glass of water / a man is drinking water / a man is drinking a drink / a chef takes a drink of his / we have of the cucumber water but we / a man is drinking cucumber water / a man is drinking a cup of water / a man is drinking a glass of clear liquid / the man is drinking something / the man is drinking cucumber water / jack is show how to prepare the food / a man is drinking water / a man drinks from a glass / a man is taking a drink / a man is drinking / a man is drinking something out of a glass / a man pours and drinks a glass of water with / the man drank a glass of water / a man is drinking water / a man is drinking something / a man is drinking a glass of water / a person is drinking / super making for lazy mans drinking video / a man pouring a fruit juice / man having a glass of water / a man is drinking a clear liquid from a glass / a man is drinking / a lazy man drinks water from the glass / the man is drinking a glass of water / a fat men drinking the water / a man is drinking water from a glass / the man drank a class of water / a man is drinking from a glass / the man took a of water / a man drinks out of a glass / a man drinks water / a man is drinking from a glass / a man standing in the kitchen drinks cold cucumber water / a man is drinking water from the glass / the man is drinking water
zzit5b_-ukg_5_20, a man is cutting a rope, a kid is playing on exercise equipment / a boy is playing on a bike / a boy plays on an exercise machine / a boy rides on an machine / a kid is trying to do some kind of exercise / a boy is practicing cycling / a kid is exercising / a child is on a / a young child is using an exercise machine / a boy is doing exercise on machine / a small boy is using a cross trainer / a child uses an exercise machine / a boy is / a little boy plays on an exercise machine / a little boy is riding an machine / a boy is using an exercise machine / children bodybuilder / a kid is exercising in a / a small boy is using an exercise machine / a young boy is using a ski machine / the small boy is in cycling / the boy is exercising / a boy playing their / shows a little boy trying to ride on / the little boy rode an exercise machine / the small boy is doing the exercise / the boy is on the exercising machine / a boy is using exercise equipment / a little boy is playing on a / a boy is doing exercise by cycle / a little boy is using an exercise machine / the little boy rode the exercise machine / a little boy is using an exercise machine / a child is playing on exercise equipment / a little boy is riding a bicycle / a small boy riding / a child play with a machine / a boy playing / a young boy is exercising on an exercise machine / a boy is using exercise equipment / a young child is operating an exercise machine
nlU3crMsbWI_19_23, a person is cutting a carrot, someone is drawing a picture / several people paint a room / some person doing painting / a group of guys are painting the wall / a person draws an old womans face on a piece / someone is drawing a / a person is drawing / a person is drawing a picture / an artist drew a picture / somebody is drawing / a person is drawing with a pencil / three boys doing art work / a some sort of women art and trees / a man is drawing a picture / people painting / a man is drawing / a man is drawing a / a is drawn which is to be painted / they are painting / some one drawing a picture / a man is drawing a picture / a group of guys are painting on the wall / few guys are painting on the wall / a man is drawing a picture / man drawing on a white paper / an artist a picture / someone is drawing a face on a piece of paper / a man trying to make a painting on a paper / the person draw the / a man is adding touches to a drawing on / someone is drawing / an artist touching up a drawing drawn / an artist performing arts / someone is drawing a picture / a person is drawing a picture on a piece of / a person draws a / a person is drawing / a person is drawing on a paper / the man drew a picture / a person is drawing some cartoon / a person is drawing / a person is drawing / an artist explains a / the man is drawing / someone is drawing a / a person is drawing on paper / a person is drawing a picture / a man is painting / a person is drawing a picture and mixing paint
kWLNZzuo3do_222_227, a person is cooking, a woman a piece of seafood / a lady is dipping the prawn in to the dough / a woman is dipping a piece of fish into some / the woman is shrimp / a lady is preparing food / the lady the shrimp / a woman is dipping a piece of shrimp into batter / a woman adding seasoning to mix flour / a woman dips a shrimp in batter / a woman is placing shrimp in a bowl of sauce / the lady dipped the shrimp in batter / a woman is breading a piece of shrimp / a woman dips a shrimp into a bowl containing flour / a woman is dipping fish into batter / there is a one curry with boiling / a man cooking his kichen / a woman dips a shrimp in butter / the woman is dipping shrimp into the batter / a woman dips shrimp into a batter / a women is making dish / someone is breading meat to fry / a woman is putting shrimp into a batter / a woman is food to deep fry / super dish for noodle preparing video / frying fish by dipping it in a mix / a lady fish in a yellow substance / cooking with the dog show presents how to make / a woman is putting fish into a bowl / someone preparing something / a woman a raw shrimp / a woman is breading shrimp / a woman is dipping prawns into a batter / showing how to make noodle / a woman is coating shrimp / one man is making noodle
jTaLGh_MKCM_5_20, a man is talking, a man is explaining something / a man in a white outfit is looking and speaking / a man is speaking / a man is telling to do up / the man talked about the / a man speaks into a camera / a lone young man practicing football tricks / a person is giving speech on soccer / the player is showing how to play football tricks / a man is talking about footbal tricks / a is telling about football / a man describing about the soccer tricks / a soccer player tips about his / the man gave a talk on a / a man talks about soccer / a man playing football / a man standing on a football ground talks about / a man is talking about soccer / a man is talking / a man is speaking on the ground / a man is talking to the camera / a player is giving speech / a man talking on a soccer field / a man is speaking / speaking about football tricks / a man is speaking to the camera / a guy is doing up / a boy teach how to play football / a man is talking on a soccer field / a man talks / a man is talking while standing on a soccer field / a soccer player teaching some sort of techniques for the / a man is talking to a camera / the person is giving speech / a man is talking / the man is talking / a football player is speaking / a man is standing on a soccer field talking / football tricks and up / a player is speaking on a sports field / a man looks into the camera and talks / a men speaking their / a man is talking to the camera / a man is talking / a man is talking / a football player is / a man talking about up exercise
nhm_APPwhWk_6_12, a man is riding a bike, a person riding a motorcycle crashes / a man is doing bike stunts / a man is crashing his bike when trying to perform / a man crashes his motorcycle / a man wrecks on his motorcycle / a biker is doing stunt and is been / a man doing a wheeling on his motorcycle crashes / a motorcyclist is driving with only the back wheel touching / a funny crashes / a biker lifted front wheel to show stunt and fall / a bike wheeling ends in an accident / a man crashes a motorcycle / a bike crash / the rider fell off his motorbike / the fell off his bike / the man fell off his motorcycle / a motorcyclist wipes out on a dirt road / funny clips / a man riding a bike on a road by the / a man falls off a motorcycle while attempting to do / someone wrecks a motorcycle / a person is falling off his motorbike after attempting a / a dirt bike / a man is riding a bike / a guy is a motorcycle / is being shown by a person and accident took / a crash in a ride / a motorcyclist is riding down the road when he does / a man on bike / a bike rider met an accident / a man performing some stunts on his bike / a guy pops a wheelie on his motorcycle and wipes / the person is bike riding / a man falls off of a motorcycle / this is a funny crashes / a person falls off while riding a dirt bike / a man from motor bike / a person is riding bicycle / a dirt bike rider falling out a dirt bike / a man is riding the bike and falling down / a small motor boat crash / a man trying to ride a motorbike on rear wheel / the car is crashed in the road / a man riding a motorcycle down a street does a / bike accident is very funny / a motorcycle pops a wheelie and the driver comes off / a man is riding on the motorcycle / a man fell down while riding on a bike / a men with funny crashes / a person is riding on a motorcycle and crashing / a motorcyclist falls off of his motorcycle while doing a / a video on the most funny crashes / an individual falls off a bike and hits the ground / someone fell off a motorcycle / a man is crashing down from his bike / a man falls off his motor bike / a biker with a very high speed get on / funny crashes / a man on a motorcycle crashes
